{
  "id": 1,
  "uuid": "a1b2c3d4-e5f6-4a7b-8c9d-0e1f2a3b4c5d",
  "establishment": 1,
  "customer": 1,
  "created_by": 1,
  "call_number": 42,
  "call_name": "Window",
  "running_tax_number": 42,
  "web_order": true,
  "is_invoice": true,
  "closed": true,
  "printed": true,
  "has_items": true,
  "has_history": true,
  "dining_option": 42,
  "delivery_employee": 42,
  "device_id": 1,
  "local_id": "LOC-1",
  "pickup_time": "2026-06-01T12:00:00Z",
  "created_date": "2026-06-01T12:00:00Z",
  "updated_date": "2026-06-01T12:00:00Z",
  "resource_uri": "/resources/Resource/1/"
}